{"$schema":"https://json-schema.org/draft/2020-12/schema","title":"EV4 Diagnostic Request","type":"object","required":["schema","template_id","runtime_state","claim_type","source","targets"],"properties":{"schema":{"const":"ev4-diagnostic-request@1.0.0"},"template_id":{"type":"string","pattern":"^[a-z0-9_]+_v[0-9]+$"},"runtime_state":{"enum":["CORRECTION","EVIDENCE_REQUIRED","insufficient_evidence","repair","claim_level_verification"]},"claim_type":{"enum":["rendered_dom_computed_style","layout_value","claim_level_verification"]},"source":{"const":"diagnostic_template_registry"},"targets":{"type":"array","minItems":1,"maxItems":20,"items":{"type":"object","required":["label","selector"],"properties":{"label":{"type":"string","minLength":1,"maxLength":80},"selector":{"type":"string","minLength":1,"maxLength":160,"pattern":"^[A-Za-z0-9_.#\\- >]+$"}},"additionalProperties":false}}},"additionalProperties":false}