{"schema":"ev4-diagnostic-request@1.0.0","template_id":"elementor_rendered_dom_computed_v1","runtime_state":"CORRECTION","claim_type":"rendered_dom_computed_style","source":"diagnostic_template_registry","targets":[{"label":"feature card","selector":".smart-home__feature-card--default"},{"label":"card icon","selector":".smart-home__card-icon--default"},{"label":"section card","selector":"#smart-home-section .smart-home__feature-card--default"},{"label":"nested","selector":".a > .b"}]}
